{
  "schema_version": "1",
  "updated_at": "2026-09-16T13:15:00Z",
  "environments": {
    "testnet": {
      "network": "testnet",
      "status": "deployed",
      "contracts": {
        "axionvera_vault_contract": {
          "contract_id": "CAZGEBQ3MAU7CAUOCKGFUSC2MVLAPOHWJ4V3H4NY2L6RNV3MEHQIIP6J",
          "wasm_sha256": "d1ea47fce1eb7d5f8efc39d4c8462d496b11f2632ed1b40631eb0d7e8a0f2b45",
          "deployed_at": "2026-09-16T13:15:00Z",
          "deployer_address": "GDGOJ2KHXL3BSWHDFQYIOTCGBYP5SE4NGPUJY7XUVQX75SYKIMPJG7BO",
          "source_commit": "d8010c077c609c030dcd744ffbab9f2c0e31ac3f",
          "notes": [
            "Hardened deployment with admin authorization required for reward mutation functions."
          ]
        },
        "deposit_token": {
          "contract_id": "CDLZFC3SYJYDZT7K67VZ75HPJVIEUVNIXF47ZG2FB2RMQQVU2HHGCYSC",
          "wasm_sha256": "SHA256_PLACEHOLDER",
          "deployed_at": "2026-09-12T15:05:24Z",
          "deployer_address": "GDGOJ2KHXL3BSWHDFQYIOTCGBYP5SE4NGPUJY7XUVQX75SYKIMPJG7BO",
          "asset": "native"
        },
        "reward_token": {
          "contract_id": "CDLZFC3SYJYDZT7K67VZ75HPJVIEUVNIXF47ZG2FB2RMQQVU2HHGCYSC",
          "wasm_sha256": "SHA256_PLACEHOLDER",
          "deployed_at": "2026-09-12T15:05:24Z",
          "deployer_address": "GDGOJ2KHXL3BSWHDFQYIOTCGBYP5SE4NGPUJY7XUVQX75SYKIMPJG7BO",
          "asset": "native"
        }
      }
    }
  },
  "maintainer_deployment_boundary": {
    "no_secrets_included": true,
    "real_deployments_recorded": true
  }
}
